{
  "$schema": "https://json-schema.org/draft/2020-12/schema",
  "$id": "https://recruitment-genie/shared/scoring.repository_skill.schema.json",
  "title": "Module C.1 — Deterministic Evidence Score",
  "description": "Output of the evidence scorer: one document per (repository, skill) pair. `confidence` is written to REPOSITORY_SKILL.confidence. Every score carries the signal values and the weights that produced it, so any number can be decomposed back to raw facts rather than defended with 'the model said so'.",
  "type": "object",
  "required": ["schema_version", "repo_id", "skill_id", "skill_name", "confidence", "formula_version", "weights", "signals", "computed_at"],
  "additionalProperties": false,
  "properties": {
    "schema_version": { "$ref": "common.schema.json#/$defs/schema_version" },
    "repo_id":    { "$ref": "common.schema.json#/$defs/repo_id" },
    "skill_id":   { "$ref": "common.schema.json#/$defs/skill_id" },
    "skill_name": { "$ref": "common.schema.json#/$defs/skill_name" },

    "confidence": {
      "$ref": "common.schema.json#/$defs/unit_interval",
      "description": "The Evidence Score: weighted sum of the signals below, divided by the sum of applied weights. Means 'strong observable evidence exists', NOT 'probability the candidate knows the skill'."
    },

    "formula_version": {
      "type": "string",
      "description": "Identifies the weight set and normalisation rules used. Two rows with the same formula_version are comparable; across versions they are not."
    },

    "weights": {
      "type": "object",
      "description": "System-defined, never model-generated. w_llm exists because the idea doc lists six signals but only five formula terms; default it to 0 to keep LLM text out of the arithmetic, or give it a weight and say so explicitly.",
      "required": ["w_language", "w_dependency", "w_code", "w_keyword", "w_semantic"],
      "additionalProperties": false,
      "properties": {
        "w_language":   { "type": "number", "minimum": 0 },
        "w_dependency": { "type": "number", "minimum": 0 },
        "w_code":       { "type": "number", "minimum": 0 },
        "w_keyword":    { "type": "number", "minimum": 0 },
        "w_semantic":   { "type": "number", "minimum": 0 },
        "w_llm":        { "type": "number", "minimum": 0, "default": 0 }
      }
    },

    "signals": {
      "type": "object",
      "required": ["language", "dependency", "code", "keyword", "semantic"],
      "additionalProperties": false,
      "properties": {
        "language":   { "$ref": "#/$defs/signal" },
        "dependency": { "$ref": "#/$defs/signal" },
        "code":       { "$ref": "#/$defs/signal" },
        "keyword":    { "$ref": "#/$defs/signal" },
        "semantic":   { "$ref": "#/$defs/signal" },
        "llm": {
          "allOf": [{ "$ref": "#/$defs/signal" }],
          "description": "Module B's natural-language evidence, present for auditability whether or not w_llm is non-zero."
        }
      }
    },

    "nl_evidence": {
      "type": "string",
      "description": "Copied from Module B; written to SKILL_EVIDENCE.evidence and shown to the recruiter."
    },

    "source": {
      "type": "object",
      "description": "Exact inputs this score was computed from, for reproducibility.",
      "additionalProperties": false,
      "properties": {
        "commit_sha": { "type": "string" },
        "raw_features_version": { "$ref": "common.schema.json#/$defs/schema_version" },
        "llm_evidence_version": { "$ref": "common.schema.json#/$defs/schema_version" }
      }
    },

    "computed_at": { "$ref": "common.schema.json#/$defs/timestamp" }
  },

  "$defs": {
    "signal": {
      "type": "object",
      "required": ["value"],
      "additionalProperties": false,
      "properties": {
        "value": { "$ref": "common.schema.json#/$defs/unit_interval" },
        "detail": {
          "type": "string",
          "description": "Human-readable reason for the value, e.g. 'python = 82% of repo bytes' or 'fastapi found in requirements.txt'."
        },
        "matches": {
          "type": "array",
          "items": { "type": "string" },
          "description": "The concrete things that fired: package names, import lines, README terms."
        },
        "applied": {
          "type": "boolean",
          "default": true,
          "description": "false when the signal is not meaningful for this skill (e.g. language % for Docker). Unapplied signals are excluded from both numerator and denominator rather than scored as 0."
        }
      }
    }
  }
}
