{
  "schema_version": "1.0.0",
  "repo_id": "R001",
  "skill_id": "SK01",
  "skill_name": "Python",
  "confidence": 0.98,
  "formula_version": "evidence-v1",
  "weights": { "w_language": 0.25, "w_dependency": 0.2, "w_code": 0.25, "w_keyword": 0.1, "w_semantic": 0.2, "w_llm": 0 },
  "signals": {
    "language":   { "value": 1.0,  "detail": "python = 82% of repo bytes, above the 60% saturation point", "applied": true },
    "dependency": { "value": 0.9,  "detail": "2 of 2 Python-ecosystem packages matched", "matches": ["fastapi", "psycopg2"] },
    "code":       { "value": 1.0,  "detail": "Python imports and API routes detected", "matches": ["from fastapi import FastAPI", "@app.get('/products')"] },
    "keyword":    { "value": 0.85, "detail": "README mentions Python-adjacent terminology", "matches": ["FastAPI", "REST"] },
    "semantic":   { "value": 0.93, "detail": "cosine(SK01 description, repo content)" },
    "llm":        { "value": 1.0,  "detail": "Backend services implemented in Python", "applied": false }
  },
  "nl_evidence": "Backend services implemented in Python",
  "source": { "commit_sha": "9f2c1ab", "raw_features_version": "1.0.0", "llm_evidence_version": "1.0.0" },
  "computed_at": "2026-09-01T06:03:00Z"
}
